{
  "$schema": "https://json-schema.org/draft/2020-12/schema",
  "$id": "https://raw.githubusercontent.com/CatVinci-Studio/Textus/main/docs/dev/textus-plugin.schema.json",
  "title": "textus-plugin.json",
  "description": "A Textus plugin's manifest, as src/plugins/store/manifest.ts reads it. docs/dev/writing-plugins.md says what each field does.",
  "type": "object",
  "required": ["id", "name", "version", "publisher", "engines", "main"],
  "properties": {
    "$schema": {
      "type": "string"
    },
    "id": {
      "description": "publisher.name, lowercase.",
      "type": "string",
      "pattern": "^[a-z0-9][a-z0-9-]{0,63}\\.[a-z0-9][a-z0-9-]{0,63}$"
    },
    "name": {
      "type": "string",
      "description": "Or %key% of l10n."
    },
    "version": {
      "type": "string",
      "pattern": "^\\d+\\.\\d+\\.\\d+(-[0-9A-Za-z.-]+)?$"
    },
    "publisher": {
      "type": "string"
    },
    "author": {
      "type": "string"
    },
    "description": {
      "type": "string"
    },
    "icon": {
      "type": "string"
    },
    "license": {
      "type": "string"
    },
    "repository": {
      "type": "string"
    },
    "engines": {
      "type": "object",
      "required": ["textus"],
      "properties": {
        "textus": {
          "type": "string",
          "description": "^1.3.0, >=1.3.0, 1.3.x or an exact version. A range naming a pre-release (>=1.3.0-beta.2) tells the betas apart."
        }
      }
    },
    "main": {
      "description": "The host code, or several files run in order.",
      "oneOf": [
        {
          "type": "string"
        },
        {
          "type": "array",
          "items": {
            "type": "string"
          },
          "minItems": 1
        }
      ]
    },
    "activationEvents": {
      "type": "array",
      "items": {
        "type": "string"
      },
      "description": "When the plugin starts. Left out, Textus starts it the first time something it adds is used; [\"onStartupFinished\"] starts it with Textus, [\"onHover\"] on the first hover over a link, [\"onEditor\"] once a document is open (a plugin that marks the text)."
    },
    "permissions": {
      "type": "array",
      "items": {
        "type": "string",
        "anyOf": [
          {
            "enum": [
              "editor.read",
              "editor.write",
              "editor.propose",
              "editor.input",
              "files.read",
              "files.write",
              "clipboard",
              "project.data",
              "ai.tools"
            ]
          },
          {
            "pattern": "^network:.+"
          }
        ]
      }
    },
    "requires": {
      "type": "array",
      "items": {
        "type": "object",
        "required": ["setting"],
        "properties": {
          "setting": {
            "enum": ["runInBackground"]
          },
          "reason": {
            "type": "string"
          }
        }
      }
    },
    "contributes": {
      "type": "object",
      "properties": {
        "commands": {
          "type": "array",
          "items": {
            "type": "object",
            "required": ["command", "title"],
            "properties": {
              "command": {
                "type": "string"
              },
              "title": {
                "type": "string"
              }
            }
          }
        },
        "keybindings": {
          "type": "array",
          "items": {
            "type": "object",
            "required": ["command", "key"],
            "properties": {
              "command": {
                "type": "string"
              },
              "key": {
                "type": "string",
                "description": "mod+alt+w"
              }
            }
          }
        },
        "menus": {
          "type": "object",
          "propertyNames": {
            "enum": [
              "editor/context",
              "file/context",
              "tab/context",
              "view/title",
              "app/plugins",
              "app/tray"
            ]
          },
          "additionalProperties": {
            "type": "array",
            "items": {
              "type": "object",
              "required": ["command"],
              "properties": {
                "command": {
                  "type": "string"
                },
                "when": {
                  "type": "string",
                  "description": "editorHasSelection, documentOpen, folderOpen, fileExtension == .pdf, view == <view id>; && || ! and ( ) (src/plugins/contributions/when.ts)"
                },
                "icon": {
                  "type": "string",
                  "description": "view/title: an icon in place of the title"
                }
              }
            }
          }
        },
        "sidebarTabs": {
          "type": "array",
          "items": {
            "type": "object",
            "required": ["id", "title"],
            "properties": {
              "id": {
                "type": "string"
              },
              "title": {
                "type": "string"
              },
              "icon": {
                "type": "string"
              },
              "type": {
                "enum": ["webview", "list"],
                "description": "list: drawn by Textus from views.registerList's items; webview (the default): a page of the plugin's"
              }
            }
          }
        },
        "views": {
          "type": "array",
          "items": {
            "type": "object",
            "required": ["id", "title"],
            "properties": {
              "id": {
                "type": "string"
              },
              "title": {
                "type": "string"
              },
              "type": {
                "enum": ["webview", "list"],
                "description": "list: drawn by Textus from views.registerList's items; webview (the default): a page of the plugin's"
              }
            }
          }
        },
        "customEditors": {
          "type": "array",
          "items": {
            "type": "object",
            "required": ["viewType", "displayName", "filenamePatterns"],
            "properties": {
              "viewType": {
                "type": "string"
              },
              "displayName": {
                "type": "string"
              },
              "filenamePatterns": {
                "type": "array",
                "items": {
                  "type": "string"
                },
                "minItems": 1
              },
              "priority": {
                "enum": ["default", "option"]
              }
            }
          }
        },
        "settings": {
          "type": "array",
          "items": {
            "type": "object",
            "required": ["key", "type", "title", "default"],
            "properties": {
              "key": {
                "type": "string"
              },
              "type": {
                "enum": ["boolean", "string", "number", "enum"]
              },
              "title": {
                "type": "string"
              },
              "description": {
                "type": "string"
              },
              "default": {},
              "options": {
                "type": "array",
                "items": {
                  "type": "object",
                  "required": ["value", "label"],
                  "properties": {
                    "value": {
                      "type": "string"
                    },
                    "label": {
                      "type": "string"
                    }
                  }
                }
              }
            }
          }
        },
        "settingsPage": {
          "type": "object",
          "required": ["title"],
          "properties": {
            "title": {
              "type": "string"
            }
          }
        },
        "themes": {
          "type": "array",
          "items": {
            "type": "object",
            "required": ["id", "label", "path"],
            "properties": {
              "id": {
                "type": "string"
              },
              "label": {
                "type": "string"
              },
              "path": {
                "type": "string"
              }
            }
          }
        },
        "aiTools": {
          "type": "array",
          "description": "Tools Textus AI may call (ai.tools), run by textus.ai.registerTool.",
          "items": {
            "type": "object",
            "required": ["name", "description"],
            "properties": {
              "name": {
                "type": "string",
                "pattern": "^[A-Za-z0-9_-]{1,40}$"
              },
              "description": {
                "type": "string"
              },
              "parameters": {
                "type": "object",
                "description": "A JSON schema of its arguments."
              }
            }
          }
        },
        "completions": {
          "type": "array",
          "description": "Completions suggested as you type (document.read), answered by textus.editor.registerCompletionProvider(id).",
          "items": {
            "type": "object",
            "required": ["id", "pattern"],
            "properties": {
              "id": {
                "type": "string",
                "description": "Starts with the plugin's id and a dot."
              },
              "where": {
                "enum": ["math", "text", "any"],
                "description": "In a formula, in the text, or both (the default)."
              },
              "pattern": {
                "type": "string",
                "description": "A regular expression the text before the caret must end with, such as \\\\[A-Za-z]*."
              }
            }
          }
        },
        "links": {
          "type": "array",
          "description": "Links the plugin opens when one is Ctrl/Cmd+clicked in a document, instead of the browser: the command runs with the URL.",
          "items": {
            "type": "object",
            "required": ["pattern", "command"],
            "properties": {
              "pattern": {
                "type": "string",
                "description": "A regular expression the link's URL must match, such as ^https?://."
              },
              "command": {
                "type": "string",
                "description": "One of the plugin's contributes.commands; it is given the URL."
              }
            }
          }
        },
        "codeBlocks": {
          "type": "array",
          "description": "Code blocks of a language the plugin draws in the document, answered by textus.views.registerCodeBlock(language).",
          "items": {
            "type": "object",
            "required": ["language"],
            "properties": {
              "language": {
                "type": "string",
                "pattern": "^[a-z][a-z0-9-]{0,31}$"
              },
              "title": {
                "type": "string"
              }
            }
          }
        }
      }
    },
    "l10n": {
      "type": "object",
      "description": "Strings by language: { \"en\": { \"key\": \"text\" }, \"zh\": {...} }.",
      "additionalProperties": {
        "type": "object",
        "additionalProperties": {
          "type": "string"
        }
      }
    }
  }
}
